{
  "schema_version": "miskatonic.candidate-application-receipt.v0.1",
  "application_id": "app-rec-na-a380a26bbb964d84",
  "candidate_id": "macro_mul_one_add_zero",
  "candidate_artifact_digest": "273a1d821e54ba6bf1832a2f1f11b338853aa9d1070d873c8b29345ba5aae903",
  "candidate_kind": "TACTIC_MACRO",
  "applicator_id": "msk-candidate-applicator-v0.1",
  "applicator_version": "0.1.0",
  "applicator_implementation_digest": "04e4418028c480a2963242e678af5cf7070257d2b0f2f38b3a7016ee3c2c5360",
  "experimental_unit_id": "fam-pos-08-r3",
  "problem_digest": "519b37b63195c6520108d6f06e3dd14e35de6943c8bde1806b448e173c3f73aa",
  "input_state_digest": "4c4422410f1e9152129542dede3191d75b33c2c515a2c2b955890302410480f3",
  "candidate_pattern_digest": "52d270b01c9676fda19b328ad50eb32915d3889f36b1254338f8a24300c53952",
  "substitution_witness": {},
  "primitive_expansion": [
    "MUL_ONE_LEFT",
    "ADD_ZERO_RIGHT"
  ],
  "primitive_expansion_digest": "a0c0530be492cc6426580e41e90909192e1ac59d0f2e8e0e479d810bbc8642ea",
  "pre_action_surface_digest": "ffec200bcf39336433e04d41fbfc5a3f192a700470c7e71a0357e296827f567a",
  "post_action_surface_digest": "ffec200bcf39336433e04d41fbfc5a3f192a700470c7e71a0357e296827f567a",
  "output_macro_action_digest": "0000000000000000000000000000000000000000000000000000000000000000",
  "output_state_digest": null,
  "transition_model_digest": "5b8c7684d6574e837cdde60bd4f5e02c36e793621856e6b6eec0d1b86343811c",
  "application_status": "NOT_APPLICABLE",
  "started_at": "2026-09-12T23:43:13.194779+00:00",
  "completed_at": "2026-09-12T23:43:13.194824+00:00",
  "receipt_digest": "95a3003f30b21854af9363fdfdfc0a2a6cca398a7f1987ed3656de766fffb221",
  "authority": "NONE"
}