{
  "schema_version": "miskatonic.candidate-application-receipt.v0.1",
  "application_id": "app-rec-applied-dbb6ef42776796db",
  "candidate_id": "macro_mul_one_add_zero",
  "candidate_artifact_digest": "273a1d821e54ba6bf1832a2f1f11b338853aa9d1070d873c8b29345ba5aae903",
  "candidate_kind": "TACTIC_MACRO",
  "applicator_id": "msk-candidate-applicator-v0.1",
  "applicator_version": "0.1.0",
  "applicator_implementation_digest": "04e4418028c480a2963242e678af5cf7070257d2b0f2f38b3a7016ee3c2c5360",
  "experimental_unit_id": "fam-pos-05-r0",
  "problem_digest": "5d9717eb79209df7a170abf2b690739eeea662171917f3bd3a3f10310333ddff",
  "input_state_digest": "bcd75908132759bcfa3e3d1ae203eb0f83deb3143b7f33a25a774a867d793ab7",
  "candidate_pattern_digest": "52d270b01c9676fda19b328ad50eb32915d3889f36b1254338f8a24300c53952",
  "substitution_witness": {
    "step_0_X": "add(ke, 0)",
    "step_1_X": "ke"
  },
  "primitive_expansion": [
    "MUL_ONE_LEFT",
    "ADD_ZERO_RIGHT"
  ],
  "primitive_expansion_digest": "a0c0530be492cc6426580e41e90909192e1ac59d0f2e8e0e479d810bbc8642ea",
  "pre_action_surface_digest": "192db8a74768dda0cf657c8dfd7155a9165c0fda0c109de1214cd81beb30fda9",
  "post_action_surface_digest": "a3d091c11201e5de6a098dbca5aef9d28c9d3820f12b8e9b9ffb97c8d7e3a6bd",
  "output_macro_action_digest": "d6895bf60331c89e676bea66ade48266147ef022b5828b7a1e2cf6abd5731a84",
  "output_state_digest": "85ba2ab3ffcc612b2f6c3c350887ef6c657a40731899259993a48da433a8bf78",
  "transition_model_digest": "5b8c7684d6574e837cdde60bd4f5e02c36e793621856e6b6eec0d1b86343811c",
  "application_status": "APPLIED",
  "started_at": "2026-09-13T01:02:33.556018+00:00",
  "completed_at": "2026-09-13T01:02:33.556091+00:00",
  "receipt_digest": "0aa9a140b28a44393456faaac90562109f6827814ab6a4c6bba0eed581df2604",
  "authority": "NONE"
}