{
  "schema_version": "miskatonic.candidate-application-receipt.v0.1",
  "application_id": "app-rec-applied-5447305f905afcd0",
  "candidate_id": "macro_mul_one_add_zero",
  "candidate_artifact_digest": "273a1d821e54ba6bf1832a2f1f11b338853aa9d1070d873c8b29345ba5aae903",
  "candidate_kind": "TACTIC_MACRO",
  "applicator_id": "msk-candidate-applicator-v0.1",
  "applicator_version": "0.1.0",
  "applicator_implementation_digest": "04e4418028c480a2963242e678af5cf7070257d2b0f2f38b3a7016ee3c2c5360",
  "experimental_unit_id": "fam-pos-02-r2",
  "problem_digest": "673e584c019cbaf04b41d108413dfb2225498de5d97fa59f183089e99ee41921",
  "input_state_digest": "cc73101c39bd35c02a38e5d19342242b5b8253ec9cb4be6c9d8e33652e93dc2b",
  "candidate_pattern_digest": "52d270b01c9676fda19b328ad50eb32915d3889f36b1254338f8a24300c53952",
  "substitution_witness": {
    "step_0_X": "kb",
    "step_1_X": "kb"
  },
  "primitive_expansion": [
    "MUL_ONE_LEFT",
    "ADD_ZERO_RIGHT"
  ],
  "primitive_expansion_digest": "a0c0530be492cc6426580e41e90909192e1ac59d0f2e8e0e479d810bbc8642ea",
  "pre_action_surface_digest": "83e2b39002c793d552d3cc62824cec72f27f3cee83f10dfbc2e369848f4070bd",
  "post_action_surface_digest": "07811cc68406d38c8b2b25e0d18664f2f15d6dd0ec45c4b25b0d15c726f594aa",
  "output_macro_action_digest": "e3550070ef6a976d85a6894d39a3e9517c6837eb5553e0694eb361a3bea8c833",
  "output_state_digest": "18c69545ec779088a80102005431021a4826c673495e09f8463cd9acde5df339",
  "transition_model_digest": "5b8c7684d6574e837cdde60bd4f5e02c36e793621856e6b6eec0d1b86343811c",
  "application_status": "APPLIED",
  "started_at": "2026-09-12T23:43:08.244537+00:00",
  "completed_at": "2026-09-12T23:43:08.244629+00:00",
  "receipt_digest": "2f14dcf32dd02f7f26ebc576669707b1d15c26a700c23b7830b7b07a4fb22730",
  "authority": "NONE"
}