{
  "schema_version": "miskatonic.candidate-application-receipt.v0.1",
  "application_id": "app-rec-na-bbaec9b5dec8bc5e",
  "candidate_id": "macro_mul_one_add_zero",
  "candidate_artifact_digest": "273a1d821e54ba6bf1832a2f1f11b338853aa9d1070d873c8b29345ba5aae903",
  "candidate_kind": "TACTIC_MACRO",
  "applicator_id": "msk-candidate-applicator-v0.1",
  "applicator_version": "0.1.0",
  "applicator_implementation_digest": "04e4418028c480a2963242e678af5cf7070257d2b0f2f38b3a7016ee3c2c5360",
  "experimental_unit_id": "fam-pos-01-r3",
  "problem_digest": "c710641171990909a8f0828111fca8c6b2adcde3488121d71ecef0cd01e02ada",
  "input_state_digest": "a20bc1ec2b88e2de27dad9c09001316ee3baf0c54fbb28b5b14f65d667cac49b",
  "candidate_pattern_digest": "52d270b01c9676fda19b328ad50eb32915d3889f36b1254338f8a24300c53952",
  "substitution_witness": {},
  "primitive_expansion": [
    "MUL_ONE_LEFT",
    "ADD_ZERO_RIGHT"
  ],
  "primitive_expansion_digest": "a0c0530be492cc6426580e41e90909192e1ac59d0f2e8e0e479d810bbc8642ea",
  "pre_action_surface_digest": "a81efaafa55997eda5a5746ba556ae4a4ef324d1b3084b7f09b18b934824ccd7",
  "post_action_surface_digest": "a81efaafa55997eda5a5746ba556ae4a4ef324d1b3084b7f09b18b934824ccd7",
  "output_macro_action_digest": "0000000000000000000000000000000000000000000000000000000000000000",
  "output_state_digest": null,
  "transition_model_digest": "5b8c7684d6574e837cdde60bd4f5e02c36e793621856e6b6eec0d1b86343811c",
  "application_status": "NOT_APPLICABLE",
  "started_at": "2026-09-13T01:02:31.031468+00:00",
  "completed_at": "2026-09-13T01:02:31.031500+00:00",
  "receipt_digest": "8d841ae2e7159972d6d4d6aece5839be52bbe9fe1172f17b791637d9d4594bca",
  "authority": "NONE"
}