{
  "schema_version": "miskatonic.candidate-application-receipt.v0.1",
  "application_id": "app-rec-na-4993dac4956edfd6",
  "candidate_id": "macro_mul_one_add_zero",
  "candidate_artifact_digest": "273a1d821e54ba6bf1832a2f1f11b338853aa9d1070d873c8b29345ba5aae903",
  "candidate_kind": "TACTIC_MACRO",
  "applicator_id": "msk-candidate-applicator-v0.1",
  "applicator_version": "0.1.0",
  "applicator_implementation_digest": "04e4418028c480a2963242e678af5cf7070257d2b0f2f38b3a7016ee3c2c5360",
  "experimental_unit_id": "fam-pos-02-r3",
  "problem_digest": "785414f1f825422eb8785116e6da9a405f4123b91b3c4fa7290d2e847e98549f",
  "input_state_digest": "af703bd3d2dd8f599ed0ab9f7dc9dfca777391523e717bf987372a198b8987bf",
  "candidate_pattern_digest": "52d270b01c9676fda19b328ad50eb32915d3889f36b1254338f8a24300c53952",
  "substitution_witness": {},
  "primitive_expansion": [
    "MUL_ONE_LEFT",
    "ADD_ZERO_RIGHT"
  ],
  "primitive_expansion_digest": "a0c0530be492cc6426580e41e90909192e1ac59d0f2e8e0e479d810bbc8642ea",
  "pre_action_surface_digest": "c035d5264f25f0daa45097b081832aa7e786b513e127b5b80ab10343816674f5",
  "post_action_surface_digest": "c035d5264f25f0daa45097b081832aa7e786b513e127b5b80ab10343816674f5",
  "output_macro_action_digest": "0000000000000000000000000000000000000000000000000000000000000000",
  "output_state_digest": null,
  "transition_model_digest": "5b8c7684d6574e837cdde60bd4f5e02c36e793621856e6b6eec0d1b86343811c",
  "application_status": "NOT_APPLICABLE",
  "started_at": "2026-09-13T01:02:31.790898+00:00",
  "completed_at": "2026-09-13T01:02:31.790927+00:00",
  "receipt_digest": "d945f0d5c58b9725a69875057a742c4bd6c71c460c28874be1f3ad984fe0d2eb",
  "authority": "NONE"
}