{
  "schema_version": "miskatonic.candidate-application-receipt.v0.1",
  "application_id": "app-rec-na-17aaf2ae8d979a68",
  "candidate_id": "macro_mul_one_add_zero",
  "candidate_artifact_digest": "273a1d821e54ba6bf1832a2f1f11b338853aa9d1070d873c8b29345ba5aae903",
  "candidate_kind": "TACTIC_MACRO",
  "applicator_id": "msk-candidate-applicator-v0.1",
  "applicator_version": "0.1.0",
  "applicator_implementation_digest": "04e4418028c480a2963242e678af5cf7070257d2b0f2f38b3a7016ee3c2c5360",
  "experimental_unit_id": "fam-pos-02-r1",
  "problem_digest": "a85bc947112925a35090af10f6095fd43b608cbdf52f75891ddd52b6f1ce4966",
  "input_state_digest": "c8f2d3be848aa1b13a558b565766ee4a189634282064b097867af0bc116ee0e9",
  "candidate_pattern_digest": "52d270b01c9676fda19b328ad50eb32915d3889f36b1254338f8a24300c53952",
  "substitution_witness": {},
  "primitive_expansion": [
    "MUL_ONE_LEFT",
    "ADD_ZERO_RIGHT"
  ],
  "primitive_expansion_digest": "a0c0530be492cc6426580e41e90909192e1ac59d0f2e8e0e479d810bbc8642ea",
  "pre_action_surface_digest": "0447397976951d3aa2a128f171faf9b9d8e352d0d034b746a5264bfca8cb23f4",
  "post_action_surface_digest": "0447397976951d3aa2a128f171faf9b9d8e352d0d034b746a5264bfca8cb23f4",
  "output_macro_action_digest": "0000000000000000000000000000000000000000000000000000000000000000",
  "output_state_digest": null,
  "transition_model_digest": "5b8c7684d6574e837cdde60bd4f5e02c36e793621856e6b6eec0d1b86343811c",
  "application_status": "NOT_APPLICABLE",
  "started_at": "2026-09-12T23:43:08.139215+00:00",
  "completed_at": "2026-09-12T23:43:08.139250+00:00",
  "receipt_digest": "c787dc311aecd3471f82dc96f9d69daf35aeac6b487cff03818f4d89e3241272",
  "authority": "NONE"
}