{
  "schema_version": "miskatonic.candidate-application-receipt.v0.1",
  "application_id": "app-rec-na-28dc69429a9f3fc9",
  "candidate_id": "macro_mul_one_add_zero",
  "candidate_artifact_digest": "273a1d821e54ba6bf1832a2f1f11b338853aa9d1070d873c8b29345ba5aae903",
  "candidate_kind": "TACTIC_MACRO",
  "applicator_id": "msk-candidate-applicator-v0.1",
  "applicator_version": "0.1.0",
  "applicator_implementation_digest": "04e4418028c480a2963242e678af5cf7070257d2b0f2f38b3a7016ee3c2c5360",
  "experimental_unit_id": "fam-pos-04-r3",
  "problem_digest": "a34eeb1b13b510aa3aa94a4edc8921123d722e5ffa6d8eac3f17c9abf51d26e0",
  "input_state_digest": "b9312bee5a9cfd6c1d1de5252e7ce4d6fa350f3cbf9add00a498c1bbca05f500",
  "candidate_pattern_digest": "52d270b01c9676fda19b328ad50eb32915d3889f36b1254338f8a24300c53952",
  "substitution_witness": {},
  "primitive_expansion": [
    "MUL_ONE_LEFT",
    "ADD_ZERO_RIGHT"
  ],
  "primitive_expansion_digest": "a0c0530be492cc6426580e41e90909192e1ac59d0f2e8e0e479d810bbc8642ea",
  "pre_action_surface_digest": "f9098e4a550795b94dab86bc54b62b78612336b7efb6095ae016a59a0b519616",
  "post_action_surface_digest": "f9098e4a550795b94dab86bc54b62b78612336b7efb6095ae016a59a0b519616",
  "output_macro_action_digest": "0000000000000000000000000000000000000000000000000000000000000000",
  "output_state_digest": null,
  "transition_model_digest": "5b8c7684d6574e837cdde60bd4f5e02c36e793621856e6b6eec0d1b86343811c",
  "application_status": "NOT_APPLICABLE",
  "started_at": "2026-09-13T01:02:33.335320+00:00",
  "completed_at": "2026-09-13T01:02:33.335351+00:00",
  "receipt_digest": "c30d1f2cd4f534a8232ab0e8409fc33b0cbb42ac22766fad673da87179dafe09",
  "authority": "NONE"
}