{
  "schema_version": "miskatonic.candidate-application-receipt.v0.1",
  "application_id": "app-rec-na-72e53a2a88b8132d",
  "candidate_id": "macro_mul_one_add_zero",
  "candidate_artifact_digest": "273a1d821e54ba6bf1832a2f1f11b338853aa9d1070d873c8b29345ba5aae903",
  "candidate_kind": "TACTIC_MACRO",
  "applicator_id": "msk-candidate-applicator-v0.1",
  "applicator_version": "0.1.0",
  "applicator_implementation_digest": "04e4418028c480a2963242e678af5cf7070257d2b0f2f38b3a7016ee3c2c5360",
  "experimental_unit_id": "fam-pos-03-r3",
  "problem_digest": "27a382a4cb60b007f95b01c4b1b707df6a695ea98e355f124bd009b2b221c705",
  "input_state_digest": "612f4c9c181420116ab12fd4b5fe709d832f458648f0ec3dcd815fbc68f2675c",
  "candidate_pattern_digest": "52d270b01c9676fda19b328ad50eb32915d3889f36b1254338f8a24300c53952",
  "substitution_witness": {},
  "primitive_expansion": [
    "MUL_ONE_LEFT",
    "ADD_ZERO_RIGHT"
  ],
  "primitive_expansion_digest": "a0c0530be492cc6426580e41e90909192e1ac59d0f2e8e0e479d810bbc8642ea",
  "pre_action_surface_digest": "cc60da5ec76576612decc4bc61e68dfe3b9bfa1ec725f89c6a370a03e79b0fd9",
  "post_action_surface_digest": "cc60da5ec76576612decc4bc61e68dfe3b9bfa1ec725f89c6a370a03e79b0fd9",
  "output_macro_action_digest": "0000000000000000000000000000000000000000000000000000000000000000",
  "output_state_digest": null,
  "transition_model_digest": "5b8c7684d6574e837cdde60bd4f5e02c36e793621856e6b6eec0d1b86343811c",
  "application_status": "NOT_APPLICABLE",
  "started_at": "2026-09-13T01:02:32.500085+00:00",
  "completed_at": "2026-09-13T01:02:32.500121+00:00",
  "receipt_digest": "a1ca2e28c28c60cd1cc25de062f0d3db9cbb1a3201b21777c6e5f56651df3fde",
  "authority": "NONE"
}