{
  "schema_version": "miskatonic.candidate-application-receipt.v0.1",
  "application_id": "app-rec-na-44b086acf1302cd5",
  "candidate_id": "macro_mul_one_add_zero",
  "candidate_artifact_digest": "273a1d821e54ba6bf1832a2f1f11b338853aa9d1070d873c8b29345ba5aae903",
  "candidate_kind": "TACTIC_MACRO",
  "applicator_id": "msk-candidate-applicator-v0.1",
  "applicator_version": "0.1.0",
  "applicator_implementation_digest": "04e4418028c480a2963242e678af5cf7070257d2b0f2f38b3a7016ee3c2c5360",
  "experimental_unit_id": "fam-pos-06-r3",
  "problem_digest": "ca8765215a275994692848ded77ae88a2ebd2be3cce889e13d8e24e2e0044a65",
  "input_state_digest": "3f2265a101b25e81e95ef1ac3850443634481f631dd4ac4b619c7e92da36729c",
  "candidate_pattern_digest": "52d270b01c9676fda19b328ad50eb32915d3889f36b1254338f8a24300c53952",
  "substitution_witness": {},
  "primitive_expansion": [
    "MUL_ONE_LEFT",
    "ADD_ZERO_RIGHT"
  ],
  "primitive_expansion_digest": "a0c0530be492cc6426580e41e90909192e1ac59d0f2e8e0e479d810bbc8642ea",
  "pre_action_surface_digest": "cf1159c38285b5c01b38d7a5079f87a4c997f9aa5086eb0079aef91f92bb3884",
  "post_action_surface_digest": "cf1159c38285b5c01b38d7a5079f87a4c997f9aa5086eb0079aef91f92bb3884",
  "output_macro_action_digest": "0000000000000000000000000000000000000000000000000000000000000000",
  "output_state_digest": null,
  "transition_model_digest": "5b8c7684d6574e837cdde60bd4f5e02c36e793621856e6b6eec0d1b86343811c",
  "application_status": "NOT_APPLICABLE",
  "started_at": "2026-09-12T23:43:11.735375+00:00",
  "completed_at": "2026-09-12T23:43:11.735411+00:00",
  "receipt_digest": "3f1090552e0c7222736a40d21467f439946ce5968911a63b48a507304497e8e6",
  "authority": "NONE"
}