{
  "schema_version": "miskatonic.candidate-application-receipt.v0.1",
  "application_id": "app-rec-na-53b8e746420215ee",
  "candidate_id": "macro_mul_one_add_zero",
  "candidate_artifact_digest": "273a1d821e54ba6bf1832a2f1f11b338853aa9d1070d873c8b29345ba5aae903",
  "candidate_kind": "TACTIC_MACRO",
  "applicator_id": "msk-candidate-applicator-v0.1",
  "applicator_version": "0.1.0",
  "applicator_implementation_digest": "04e4418028c480a2963242e678af5cf7070257d2b0f2f38b3a7016ee3c2c5360",
  "experimental_unit_id": "fam-neg-01-r1",
  "problem_digest": "a169906211435debb0934d4249ae93f0e120fbec619ead0988ef6309448531e0",
  "input_state_digest": "ba7a4af327f38eb8d3ba3bf5ccf441bafa62a25b4a834fc5af100086241a82b9",
  "candidate_pattern_digest": "52d270b01c9676fda19b328ad50eb32915d3889f36b1254338f8a24300c53952",
  "substitution_witness": {},
  "primitive_expansion": [
    "MUL_ONE_LEFT",
    "ADD_ZERO_RIGHT"
  ],
  "primitive_expansion_digest": "a0c0530be492cc6426580e41e90909192e1ac59d0f2e8e0e479d810bbc8642ea",
  "pre_action_surface_digest": "5cb5f6fd5b5f6a9b9ecd65dfcc8076176853dfa594ebea395ccc8f0f858c7768",
  "post_action_surface_digest": "5cb5f6fd5b5f6a9b9ecd65dfcc8076176853dfa594ebea395ccc8f0f858c7768",
  "output_macro_action_digest": "0000000000000000000000000000000000000000000000000000000000000000",
  "output_state_digest": null,
  "transition_model_digest": "5b8c7684d6574e837cdde60bd4f5e02c36e793621856e6b6eec0d1b86343811c",
  "application_status": "NOT_APPLICABLE",
  "started_at": "2026-09-12T23:43:13.534823+00:00",
  "completed_at": "2026-09-12T23:43:13.534855+00:00",
  "receipt_digest": "3938c505429dbcc95a7d274afdd1290fb7cecbc82bb9ab2d4e27b6beaf6ac48b",
  "authority": "NONE"
}