{
  "schema_version": "miskatonic.candidate-application-receipt.v0.1",
  "application_id": "app-rec-na-54e1d175c9d3aef6",
  "candidate_id": "macro_mul_one_add_zero",
  "candidate_artifact_digest": "273a1d821e54ba6bf1832a2f1f11b338853aa9d1070d873c8b29345ba5aae903",
  "candidate_kind": "TACTIC_MACRO",
  "applicator_id": "msk-candidate-applicator-v0.1",
  "applicator_version": "0.1.0",
  "applicator_implementation_digest": "04e4418028c480a2963242e678af5cf7070257d2b0f2f38b3a7016ee3c2c5360",
  "experimental_unit_id": "qual-r1-pos-02",
  "problem_digest": "02444a0f7a4bc3629d85fb417ea5720efa35525f1b6f711c5f1079a7bf7eaec9",
  "input_state_digest": "3b0046a6d8b8864ca7a6aaa29e2670d78251a9deb92b83a070d0074031b5417d",
  "candidate_pattern_digest": "52d270b01c9676fda19b328ad50eb32915d3889f36b1254338f8a24300c53952",
  "substitution_witness": {},
  "primitive_expansion": [
    "MUL_ONE_LEFT",
    "ADD_ZERO_RIGHT"
  ],
  "primitive_expansion_digest": "a0c0530be492cc6426580e41e90909192e1ac59d0f2e8e0e479d810bbc8642ea",
  "pre_action_surface_digest": "af1d916db0ad2472e91893e90b79c3e6161e7db6780ea76f97798d12e6b737c7",
  "post_action_surface_digest": "af1d916db0ad2472e91893e90b79c3e6161e7db6780ea76f97798d12e6b737c7",
  "output_macro_action_digest": "0000000000000000000000000000000000000000000000000000000000000000",
  "output_state_digest": null,
  "transition_model_digest": "5b8c7684d6574e837cdde60bd4f5e02c36e793621856e6b6eec0d1b86343811c",
  "application_status": "NOT_APPLICABLE",
  "started_at": "2026-09-12T22:03:20.102005+00:00",
  "completed_at": "2026-09-12T22:03:20.102043+00:00",
  "receipt_digest": "6f1fea7fcfeefe6d3a9c78b82eb757a7ba5e96940d1328076024931439b8291a",
  "authority": "NONE"
}