{
  "schema_version": "miskatonic.candidate-application-receipt.v0.1",
  "application_id": "app-rec-na-d0152f4bb2908b9d",
  "candidate_id": "macro_mul_one_add_zero",
  "candidate_artifact_digest": "273a1d821e54ba6bf1832a2f1f11b338853aa9d1070d873c8b29345ba5aae903",
  "candidate_kind": "TACTIC_MACRO",
  "applicator_id": "msk-candidate-applicator-v0.1",
  "applicator_version": "0.1.0",
  "applicator_implementation_digest": "04e4418028c480a2963242e678af5cf7070257d2b0f2f38b3a7016ee3c2c5360",
  "experimental_unit_id": "fam-pos-01-r3",
  "problem_digest": "c710641171990909a8f0828111fca8c6b2adcde3488121d71ecef0cd01e02ada",
  "input_state_digest": "987748b154db6eb5828d469b64d40ef1133da2e341d59fcfaed3172003d9850e",
  "candidate_pattern_digest": "52d270b01c9676fda19b328ad50eb32915d3889f36b1254338f8a24300c53952",
  "substitution_witness": {},
  "primitive_expansion": [
    "MUL_ONE_LEFT",
    "ADD_ZERO_RIGHT"
  ],
  "primitive_expansion_digest": "a0c0530be492cc6426580e41e90909192e1ac59d0f2e8e0e479d810bbc8642ea",
  "pre_action_surface_digest": "ffeba521296a4ab6258d780207b2bc68abf1f73c7e4ecb8afad48afcfde584f7",
  "post_action_surface_digest": "ffeba521296a4ab6258d780207b2bc68abf1f73c7e4ecb8afad48afcfde584f7",
  "output_macro_action_digest": "0000000000000000000000000000000000000000000000000000000000000000",
  "output_state_digest": null,
  "transition_model_digest": "5b8c7684d6574e837cdde60bd4f5e02c36e793621856e6b6eec0d1b86343811c",
  "application_status": "NOT_APPLICABLE",
  "started_at": "2026-09-13T01:02:30.998696+00:00",
  "completed_at": "2026-09-13T01:02:30.998760+00:00",
  "receipt_digest": "9d6d78bc7d3248680bc6f694a0bb05e82195bf6bafe3f8f2c8b492b1abd63e02",
  "authority": "NONE"
}