{
  "schema_version": "miskatonic.candidate-application-receipt.v0.1",
  "application_id": "app-rec-na-708b9865e35be5f8",
  "candidate_id": "macro_mul_one_add_zero",
  "candidate_artifact_digest": "273a1d821e54ba6bf1832a2f1f11b338853aa9d1070d873c8b29345ba5aae903",
  "candidate_kind": "TACTIC_MACRO",
  "applicator_id": "msk-candidate-applicator-v0.1",
  "applicator_version": "0.1.0",
  "applicator_implementation_digest": "04e4418028c480a2963242e678af5cf7070257d2b0f2f38b3a7016ee3c2c5360",
  "experimental_unit_id": "fam-neg-03-r2",
  "problem_digest": "e4fe7dd7a11e0f9245cb09f9839cf63e86a2144e5d4fdb84240cc3ad06a273d2",
  "input_state_digest": "b98d37522b09847620c57318a934bdd15493302a7a42f6e2c3091dce73a6ba70",
  "candidate_pattern_digest": "52d270b01c9676fda19b328ad50eb32915d3889f36b1254338f8a24300c53952",
  "substitution_witness": {},
  "primitive_expansion": [
    "MUL_ONE_LEFT",
    "ADD_ZERO_RIGHT"
  ],
  "primitive_expansion_digest": "a0c0530be492cc6426580e41e90909192e1ac59d0f2e8e0e479d810bbc8642ea",
  "pre_action_surface_digest": "eeba79e4bea066778a8ff9ff1b5a9a096ad2aeb3cf9b24b567182284bbe5a9da",
  "post_action_surface_digest": "eeba79e4bea066778a8ff9ff1b5a9a096ad2aeb3cf9b24b567182284bbe5a9da",
  "output_macro_action_digest": "0000000000000000000000000000000000000000000000000000000000000000",
  "output_state_digest": null,
  "transition_model_digest": "5b8c7684d6574e837cdde60bd4f5e02c36e793621856e6b6eec0d1b86343811c",
  "application_status": "NOT_APPLICABLE",
  "started_at": "2026-09-13T01:02:36.776452+00:00",
  "completed_at": "2026-09-13T01:02:36.776489+00:00",
  "receipt_digest": "7a065031d3acb8d67c068607ec47645623b76b65aa59475c993708530eff678d",
  "authority": "NONE"
}