{
  "schema_version": "miskatonic.candidate-application-receipt.v0.1",
  "application_id": "app-rec-applied-8472e66ae0cc75a1",
  "candidate_id": "macro_mul_one_add_zero",
  "candidate_artifact_digest": "273a1d821e54ba6bf1832a2f1f11b338853aa9d1070d873c8b29345ba5aae903",
  "candidate_kind": "TACTIC_MACRO",
  "applicator_id": "msk-candidate-applicator-v0.1",
  "applicator_version": "0.1.0",
  "applicator_implementation_digest": "04e4418028c480a2963242e678af5cf7070257d2b0f2f38b3a7016ee3c2c5360",
  "experimental_unit_id": "fam-pos-07-r2",
  "problem_digest": "b53a8e7d56461967adce11d8c344567fc2741309ba4cbe3c0a7d63ad7f8a3285",
  "input_state_digest": "e1b6b9ec710496507c534ec4556c456cf2a62db7d9effa2e169a94a1df0a8e30",
  "candidate_pattern_digest": "52d270b01c9676fda19b328ad50eb32915d3889f36b1254338f8a24300c53952",
  "substitution_witness": {
    "step_0_X": "1",
    "step_1_X": "kg"
  },
  "primitive_expansion": [
    "MUL_ONE_LEFT",
    "ADD_ZERO_RIGHT"
  ],
  "primitive_expansion_digest": "a0c0530be492cc6426580e41e90909192e1ac59d0f2e8e0e479d810bbc8642ea",
  "pre_action_surface_digest": "83e68886670903f9077b3fb6102e15a482f81be755291b697aa8ca19ecbb597a",
  "post_action_surface_digest": "c233c2d35cbbdfaddf73032ac7d9f4dfc003a50cb4ed2346b089c2fd8d563a77",
  "output_macro_action_digest": "c55f0478fd2c4be2cfeaf07be83cf15728f818d099e34856616c3b93b8d290a1",
  "output_state_digest": "113a266b94b7ecf4dff8c03032e45304fd575c06bde35dc112e1860a884477ad",
  "transition_model_digest": "5b8c7684d6574e837cdde60bd4f5e02c36e793621856e6b6eec0d1b86343811c",
  "application_status": "APPLIED",
  "started_at": "2026-09-12T23:43:12.273820+00:00",
  "completed_at": "2026-09-12T23:43:12.273920+00:00",
  "receipt_digest": "3d214b6d60b53f040ee0457a4763b63c6926287689aa869e0e4c006ab865bdc2",
  "authority": "NONE"
}