{
  "schema_version": "miskatonic.candidate-application-receipt.v0.1",
  "application_id": "app-rec-na-a0c70c00f56f6921",
  "candidate_id": "macro_mul_one_add_zero",
  "candidate_artifact_digest": "273a1d821e54ba6bf1832a2f1f11b338853aa9d1070d873c8b29345ba5aae903",
  "candidate_kind": "TACTIC_MACRO",
  "applicator_id": "msk-candidate-applicator-v0.1",
  "applicator_version": "0.1.0",
  "applicator_implementation_digest": "04e4418028c480a2963242e678af5cf7070257d2b0f2f38b3a7016ee3c2c5360",
  "experimental_unit_id": "fam-pos-08-r0",
  "problem_digest": "811b068742b6305e5819aa8db36f96d7b1470637c719d224ec9fe7b725c4144d",
  "input_state_digest": "ea96288471817ea12a241194f77716b2327dbd37ef962ae85e1d7e0efd25e51d",
  "candidate_pattern_digest": "52d270b01c9676fda19b328ad50eb32915d3889f36b1254338f8a24300c53952",
  "substitution_witness": {},
  "primitive_expansion": [
    "MUL_ONE_LEFT",
    "ADD_ZERO_RIGHT"
  ],
  "primitive_expansion_digest": "a0c0530be492cc6426580e41e90909192e1ac59d0f2e8e0e479d810bbc8642ea",
  "pre_action_surface_digest": "31ec6c6b936a344a5897b5fb435485ba14471a45239f38c0720597f014ae73a5",
  "post_action_surface_digest": "31ec6c6b936a344a5897b5fb435485ba14471a45239f38c0720597f014ae73a5",
  "output_macro_action_digest": "0000000000000000000000000000000000000000000000000000000000000000",
  "output_state_digest": null,
  "transition_model_digest": "5b8c7684d6574e837cdde60bd4f5e02c36e793621856e6b6eec0d1b86343811c",
  "application_status": "NOT_APPLICABLE",
  "started_at": "2026-09-12T23:43:12.696604+00:00",
  "completed_at": "2026-09-12T23:43:12.696651+00:00",
  "receipt_digest": "b286d7b25e154fe78a7203fc9dd51bc3afd8f4f2fa51286f888ab507e4aa6c13",
  "authority": "NONE"
}