{
  "schema_version": "miskatonic.candidate-application-receipt.v0.1",
  "application_id": "app-rec-na-3d1cc08660a59557",
  "candidate_id": "macro_mul_one_add_zero",
  "candidate_artifact_digest": "273a1d821e54ba6bf1832a2f1f11b338853aa9d1070d873c8b29345ba5aae903",
  "candidate_kind": "TACTIC_MACRO",
  "applicator_id": "msk-candidate-applicator-v0.1",
  "applicator_version": "0.1.0",
  "applicator_implementation_digest": "04e4418028c480a2963242e678af5cf7070257d2b0f2f38b3a7016ee3c2c5360",
  "experimental_unit_id": "fam-pos-08-r3",
  "problem_digest": "519b37b63195c6520108d6f06e3dd14e35de6943c8bde1806b448e173c3f73aa",
  "input_state_digest": "1e4adb31d052308ae544ad6956b419d1dd5c0f9866b5c27ef6e5a49680eea816",
  "candidate_pattern_digest": "52d270b01c9676fda19b328ad50eb32915d3889f36b1254338f8a24300c53952",
  "substitution_witness": {},
  "primitive_expansion": [
    "MUL_ONE_LEFT",
    "ADD_ZERO_RIGHT"
  ],
  "primitive_expansion_digest": "a0c0530be492cc6426580e41e90909192e1ac59d0f2e8e0e479d810bbc8642ea",
  "pre_action_surface_digest": "7c5668690fa3ed81b35a2842d50a91300b4b068183c10759f17d027694d099e6",
  "post_action_surface_digest": "7c5668690fa3ed81b35a2842d50a91300b4b068183c10759f17d027694d099e6",
  "output_macro_action_digest": "0000000000000000000000000000000000000000000000000000000000000000",
  "output_state_digest": null,
  "transition_model_digest": "5b8c7684d6574e837cdde60bd4f5e02c36e793621856e6b6eec0d1b86343811c",
  "application_status": "NOT_APPLICABLE",
  "started_at": "2026-09-13T01:02:36.128026+00:00",
  "completed_at": "2026-09-13T01:02:36.128060+00:00",
  "receipt_digest": "cf0aae787449653672eb1cf79d70865fd8a2009498d53e91d613e2c42d70809a",
  "authority": "NONE"
}