{
  "schema_version": "miskatonic.candidate-application-receipt.v0.1",
  "application_id": "app-rec-na-7840b1792e8f62c0",
  "candidate_id": "macro_mul_one_add_zero",
  "candidate_artifact_digest": "273a1d821e54ba6bf1832a2f1f11b338853aa9d1070d873c8b29345ba5aae903",
  "candidate_kind": "TACTIC_MACRO",
  "applicator_id": "msk-candidate-applicator-v0.1",
  "applicator_version": "0.1.0",
  "applicator_implementation_digest": "04e4418028c480a2963242e678af5cf7070257d2b0f2f38b3a7016ee3c2c5360",
  "experimental_unit_id": "qual-r1-pos-07",
  "problem_digest": "c0ce9c5b25c4941c8ab623379b3d269ada8d45dea658e3da4516fb8cca2850be",
  "input_state_digest": "d7041decce69f9edf16dc59b795b464fcce53e1c25025a5132fab56061a81d08",
  "candidate_pattern_digest": "52d270b01c9676fda19b328ad50eb32915d3889f36b1254338f8a24300c53952",
  "substitution_witness": {},
  "primitive_expansion": [
    "MUL_ONE_LEFT",
    "ADD_ZERO_RIGHT"
  ],
  "primitive_expansion_digest": "a0c0530be492cc6426580e41e90909192e1ac59d0f2e8e0e479d810bbc8642ea",
  "pre_action_surface_digest": "82a3780dabd05dfd433862d69f4ed38e58b1411feff60d25d99ad96965968b28",
  "post_action_surface_digest": "82a3780dabd05dfd433862d69f4ed38e58b1411feff60d25d99ad96965968b28",
  "output_macro_action_digest": "0000000000000000000000000000000000000000000000000000000000000000",
  "output_state_digest": null,
  "transition_model_digest": "5b8c7684d6574e837cdde60bd4f5e02c36e793621856e6b6eec0d1b86343811c",
  "application_status": "NOT_APPLICABLE",
  "started_at": "2026-09-12T22:03:20.686669+00:00",
  "completed_at": "2026-09-12T22:03:20.686705+00:00",
  "receipt_digest": "b594d4d7e02563c5793d2098f354d15ee2d00da2b2e9726ce65fafa3a0423127",
  "authority": "NONE"
}