{
  "schema_version": "miskatonic.candidate-application-receipt.v0.1",
  "application_id": "app-rec-na-b4fd26a8e5a9de37",
  "candidate_id": "macro_mul_one_add_zero",
  "candidate_artifact_digest": "273a1d821e54ba6bf1832a2f1f11b338853aa9d1070d873c8b29345ba5aae903",
  "candidate_kind": "TACTIC_MACRO",
  "applicator_id": "msk-candidate-applicator-v0.1",
  "applicator_version": "0.1.0",
  "applicator_implementation_digest": "04e4418028c480a2963242e678af5cf7070257d2b0f2f38b3a7016ee3c2c5360",
  "experimental_unit_id": "fam-pos-07-r3",
  "problem_digest": "c66e1fc08fc110bc9aba388b5acda8cac89bdeeb09d5d501d1cacf56d268cafc",
  "input_state_digest": "b86621e6245069a6252b57cffff9be4c6e15581d6889de27a546d89f7c792913",
  "candidate_pattern_digest": "52d270b01c9676fda19b328ad50eb32915d3889f36b1254338f8a24300c53952",
  "substitution_witness": {},
  "primitive_expansion": [
    "MUL_ONE_LEFT",
    "ADD_ZERO_RIGHT"
  ],
  "primitive_expansion_digest": "a0c0530be492cc6426580e41e90909192e1ac59d0f2e8e0e479d810bbc8642ea",
  "pre_action_surface_digest": "45c530eef55e06c376682754f3755592c071b2658371e4928dc45f12ee537f1e",
  "post_action_surface_digest": "45c530eef55e06c376682754f3755592c071b2658371e4928dc45f12ee537f1e",
  "output_macro_action_digest": "0000000000000000000000000000000000000000000000000000000000000000",
  "output_state_digest": null,
  "transition_model_digest": "5b8c7684d6574e837cdde60bd4f5e02c36e793621856e6b6eec0d1b86343811c",
  "application_status": "NOT_APPLICABLE",
  "started_at": "2026-09-13T01:02:35.403328+00:00",
  "completed_at": "2026-09-13T01:02:35.403369+00:00",
  "receipt_digest": "642624853989b189fb5ec5a2f87ade79a1a06b3e49b9d16e6f15d9e0211c2193",
  "authority": "NONE"
}